maxo_id	maxo_def	maxo_def_xref	ncit_def	ncit_id
MAXO:0000571	A method of examining structures within the body by scanning them with X rays and using a computer to construct a series of cross-sectional scans along a single axis.	NCIT:C17204	A method of examining structures within the body by scanning them with X rays and using a computer to construct a series of cross-sectional scans along a single axis.	NCIT:C17204
MAXO:0000499	Any form of treatment that acts to improve or assist with respiratory function.	NCIT:C15322	Any form of treatment that acts to improve or assist with respiratory function.	NCIT:C15322
MAXO:0000141	"The collecting of secretions and superficial cells of the body of uterus, cervix, and ovaries; examined with a microscope to detect any abnormal cells."	NCIT:C17348	A biospecimen collection and staining procedure in which secretions and superficial cells of the cervix are collected and stained with the Papanicolaou stain followed by microscopic examination to identify the presence of abnormal cells.	NCIT:C17348
MAXO:0000518	"The removal of a previously inserted tube from a hollow organ or passageway, often from the airway."	NCIT:C50819	"The removal of a previously inserted tube from a hollow organ or passageway, often from the airway."	NCIT:C50819
MAXO:0000832	A quantitative measurement of the amount of creatinine present in a sample of serum.	NCIT:C61023	A quantitative measurement of the amount of creatinine present in a sample of serum.	NCIT:C61023
MAXO:0000136	"A low-cost, high-resolution imaging tool consisting of a 1-mm diameter fiber-optic bundle that produces subcellular imaging at 1,000x magnification and 4 micrometer resolution, allowing for minimally invasive bioimaging."	NCIT:C116480	"A low-cost, high-resolution imaging tool consisting of a 1-mm diameter fiber-optic bundle that produces subcellular imaging at 1,000x magnification and 4 micrometer resolution, allowing for minimally invasive bioimaging."	NCIT:C116480
MAXO:0000068	"Transference of a tissue or organ within an individual, between individuals of the same species, or between individuals of different species."	NCIT:C15342	"Transference of a tissue or organ within an individual, between individuals of the same species, or between individuals of different species."	NCIT:C15342
MAXO:0000797	A technique that utilizes a Doppler transducer to monitor fetal heart rate. The transducer is placed on the maternal abdomen and detects fetal cardiac motion using ultrasound. [ NICHD NCI ]	NCIT:C114081	A technique that utilizes a Doppler transducer to monitor fetal heart rate. The transducer is placed on the maternal abdomen and detects fetal cardiac motion using ultrasound.	NCIT:C114081
MAXO:0000757	"Any form of treatment that is introduced into the body via a blood vessel, a muscle, or the spinal cord."	NCIT:C15388	"Any form of treatment that is introduced into the body via a blood vessel, a muscle, or the spinal cord."	NCIT:C15388
MAXO:0000824	A quantitative measurement of the amount of hemoglobin present in a biospecimen. [ NCI ]	NCIT:C64848	A quantitative measurement of the amount of hemoglobin present in a sample.	NCIT:C64848
MAXO:0000090	"Delivery of enteral nutrition via a tube placed into the stomach, duodenum, or jejunum."	NCIT:C93322	"Delivery of enteral nutrition via a tube placed into the stomach, duodenum, or jejunum."	NCIT:C93322
MAXO:0000787	The determination of the measured concentrations of chemical constituents of the blood by assay in a clinical laboratory. [ NCI ]	NCIT:C47868	The determination of the measured concentrations of chemical constituents of the blood by assay in a clinical laboratory.	NCIT:C47868
MAXO:0000134	"Endoscopy that employs the use of tissue stains to increase tissue contrast, and enhance the ability to identify various tissue dysplasia and other abnormalities."	NCIT:C116476	"Endoscopy that employs the use of tissue stains to increase tissue contrast, and enhance the ability to identify various tissue dysplasia and other abnormalities."	NCIT:C116476
MAXO:0000749	The removal of T-cells from the donor's hematopoietic stem cell specimen prior to its transfusion into the recipient.	NCIT:C116468	The removal of T-cells from the donor's hematopoietic stem cell specimen prior to its transfusion into the recipient.	NCIT:C116468
MAXO:0000144	Technique or procedure used for the study of the microanatomy of tissues and their cellular structure for the diagnosis or treatment of a disease.	NCIT:C16680	Technique or procedure used for the study of the microanatomy of tissues and their cellular structure; usually involves microscopic examination of tissue slices.	NCIT:C16680
MAXO:0000604	A laboratory procedure that tests the function of an endocrine organ and measures the amount of a hormone present in a sample.	NCIT:C74971	A laboratory procedure that tests the function of an endocrine organ and measures the amount of a hormone present in a sample.	NCIT:C74971
