MAXO:ID	Label	Definition	Definition Xref	parent class	parent class label	Exact synonym
ID	LABEL	A IAO:0000115	>A oboInOwl:hasDbXref	SC %		A oboInOwl:hasExactSynonym SPLIT=|
MAXO:0025001	cardiac surgery	A surgical procedure on the heart.	NCIT:C157806	MAXO:0000004	surgical procedure'	heart surgery
MAXO:0025002	heart repair	Surgical procedure to repair a heart defect.		MAXO:0009072	surgical repair'	
MAXO:0025003	vision treatment	Treatment to correct or improve vision.		MAXO:0000002	therapeutic procedure'	
MAXO:0025004	glasses usage	Use of glasses to correct vision.		MAXO:0025003	vision treatment	
MAXO:0025005	nasolacrimal duct surgery	A surgical procedure on the nasolacrimal duct.	NCIT:C157999	MAXO:0000004	surgical procedure'	dacryocystorhinostomy|tear duct surgery
MAXO:0025006	strabismus surgery	A surgical procedure to correct strabismus in the eye.		MAXO:0000004	surgical procedure'	