?cls	?def
<http://purl.obolibrary.org/obo/UBERON_0001317>	"A vein that begins near the upper part of the greater sciatic foramen, passes upward behind and slightly medial to the hypogastric artery and, at the brim of the pelvis, joins with the external iliac to form the common iliac vein. [WP,unvetted]."
<http://purl.obolibrary.org/obo/UBERON_0000165>	"The proximal portion of the digestive tract, containing the oral cavity and bounded by the oral opening. In vertebrates, this extends to the pharynx and includes gums, lips, tongue and parts of the palate. Typically also includes the teeth, except where these occur elsewhere (e.g. pharyngeal jaws) or protrude from the mouth (tusks)."
<http://purl.obolibrary.org/obo/GO_0007617>	"The behavioral interactions between organisms for the purpose of mating, or sexual reproduction resulting in the formation of zygotes."
<http://purl.obolibrary.org/obo/UBERON_0001338>	"Any of the numerous small mucous-secreting glands located in the wall of the male or female urethra that help protect the epithelium from the corrosive urine"
<http://purl.obolibrary.org/obo/UBERON_0004784>	"An anatomical wall that is part of a cardiac ventricle [Automatically generated definition]."
<http://purl.obolibrary.org/obo/UBERON_0009845>	"Mesenchyme that surrounds primitive urogenital sinus."
<http://purl.obolibrary.org/obo/CHEBI_33655>	"A cyclically conjugated molecular entity with a stability (due to delocalization) significantly greater than that of a hypothetical localized structure (e.g. Kekule structure) is said to possess aromatic character."
<http://purl.obolibrary.org/obo/UBERON_0000970>	"An organ that detects light."
<http://purl.obolibrary.org/obo/UBERON_0000062>	"Anatomical structure that performs a specific function or group of functions [WP]."
<http://purl.obolibrary.org/obo/UBERON_0004695>	"A portion of smooth muscle tissue that is part of an arterial system [Automatically generated definition]."
<http://purl.obolibrary.org/obo/CHEBI_51422>	"Any organic substituent group, regardless of functional type, having two free valences at carbon atom(s)."
<http://purl.obolibrary.org/obo/UBERON_0005426>	"Portion of tissue that gives rise to the lens."
<http://purl.obolibrary.org/obo/UBERON_0003476>	"A vein that is part of a respiratory system [Automatically generated definition]."
<http://purl.obolibrary.org/obo/UBERON_0006984>	"A two dimensional anatomical structure that is the boundary between an anatomical structure and an anatomical substance, an anatomical space or the organism's environment. Examples include the surface of your skin, the surface of the lining of your gut; the surface of the endothelium of you aorta that is in contact with blood.n"
<http://purl.obolibrary.org/obo/UBERON_0002199>	"The dermis, epidermis and hypodermis."
<http://purl.obolibrary.org/obo/UBERON_0001090>	"Joint fluid is a transudate of plasma that is actively secreted by synovial cells."
<http://purl.obolibrary.org/obo/UBERON_0010377>	"Mesenchyme that develops_from a somatopleure."
<http://purl.obolibrary.org/obo/UBERON_0001081>	"Endocardium that is part of the cardiac ventricle."
<http://purl.obolibrary.org/obo/UBERON_0000063>	"A part of an organ that constitutes a distinct modular sub-unit. In some cases, the organ may also contain other sub-units of identical or similar types, in other cases this may be a distinct entity."
<http://purl.obolibrary.org/obo/UBERON_0034705>	"An embryonic or larval epithelium that is committed to form part of the nervous system."
<http://purl.obolibrary.org/obo/UBERON_0001988>	"Portion of semisolid bodily waste discharged through the anus[MW,modified]"
<http://purl.obolibrary.org/obo/CHEBI_33674>	"An s-block molecular entity is a molecular entity containing one or more atoms of an s-block element."
<http://purl.obolibrary.org/obo/UBERON_0007524>	"Mesenchyme with little extracellular matrix."
<http://purl.obolibrary.org/obo/UBERON_0003353>	"An epithelium that is part of a hindgut [Automatically generated definition]."
<http://purl.obolibrary.org/obo/CHEBI_35337>	"Any drug that enhances the activity of the central nervous system."
<http://purl.obolibrary.org/obo/UBERON_0000164>	"the ventral part of the cloaca remaining after septation of the rectum, which further develops into part of the bladder, part of the prostatic part of the male urethra and the urethra and vestibule in females"
<http://purl.obolibrary.org/obo/UBERON_0004761>	"The primitive cartilagionous skeletal structure of the fetal skull that grows to envelop the rapidly growing embyonic brain. In humans, the chondrocranium begins forming at 28 days from mesenchymal condensations and is fully formed between week 7 and 9 of fetal development. While the majority of the chondrocranium is succeeded by the bony skull in most higher vertebrates, some components do persist into adulthood.[1] In Cartilagious fishes and Agnathans, the chondrocranium persist throughout life.[2] Embryologically, the chondrocranium represent the basal cranial structure, and lay the base for the formation of the endocranium in higher vertebrates[WP]."
<http://purl.obolibrary.org/obo/CHEBI_79008>	"The conjugate acid of (R)-nicotine arising from selective protonation of the tertiary amino group; major species at pH 7.3."
<http://purl.obolibrary.org/obo/NBO_0000317>	"\"Behavior related to the awareness of body balance and movement.\" [MBP:GVG]"
<http://purl.obolibrary.org/obo/NBO_0000327>	"\"Behavior related to the sensations arising from the skin and from the muscles, tendons, and joints.\" [OBP:GVG]"
<http://purl.obolibrary.org/obo/GO_0050896>	"Any process that results in a change in state or activity of a cell or an organism (in terms of movement, secretion, enzyme production, gene expression, etc.) as a result of a stimulus. The process begins with detection of the stimulus and ends with a change in state or activity or the cell or organism."
<http://purl.obolibrary.org/obo/GO_0008150>	"A biological process represents a specific objective that the organism is genetically programmed to achieve. Biological processes are often described by their outcome or ending state, e.g., the biological process of cell division results in the creation of two daughter cells (a divided cell) from a single parent cell. A biological process is accomplished by a particular set of molecular functions carried out by specific gene products (or macromolecular complexes), often in a highly regulated manner and in a particular temporal sequence."
<http://purl.obolibrary.org/obo/UBERON_0001262>	"An anatomical wall that is part of a intestine [Automatically generated definition]."
<http://purl.obolibrary.org/obo/UBERON_0002028>	"The most posterior of the three principal regions of the brain. In mammals and birds the hindbrain is divided into a rostral metencephalon and a caudal myelencephalon. In zebrafish, with the exception of the cerebellum, the ventral remainder of the metencephalon can be separated only arbitrarily from the more caudal myelencephalic portion of the medulla oblongata (From: Neuroanatomy of the Zebrafish Brain)[ZFA]. Organ component of neuraxis that has as its parts the pons, cerebellum and medulla oblongata[FMA]."
<http://purl.obolibrary.org/obo/NBO_0020188>	"Movement directed to the detection of new resources."@en
<http://purl.obolibrary.org/obo/UBERON_0012242>	"the usually crescent-shaped opening of the urinary bladder into the urethra, placed at the anteroinferior angle (apex) of the urinary bladder trigone"
<http://purl.obolibrary.org/obo/UBERON_0004469>	"Any collection of muscles that is part of a back [Automatically generated definition]."
<http://purl.obolibrary.org/obo/NBO_0000577>	"\"A reflex that maintains body position and equilibrium either during rest or during movement.\" [NBO:GVG]"
<http://purl.obolibrary.org/obo/UBERON_0000486>	"Epithelium which consists of more than one layer of epithelial cells that may or may not be in contact with a basement membrane. Examples: keratinized stratified squamous epithelium, ciliated stratified columnar epithelium.[FMA]"
<http://purl.obolibrary.org/obo/GO_0002118>	"A behavioral interaction between organisms in which one organism has the intention of inflicting physical damage on another individual."
<http://purl.obolibrary.org/obo/UBERON_0004909>	"An epithelium surrounding a gonad."
<http://purl.obolibrary.org/obo/UBERON_0035550>	"Any of the veins carrying deoxygenated blood from the subcutaneous tissue layers."
<http://purl.obolibrary.org/obo/UBERON_0005162>	"A structure consisting of multiple cell components but which is not itself a cell and does not have (complete) cells as a part."
<http://purl.obolibrary.org/obo/UBERON_0003236>	"An epithelium that is part of a lower jaw [Automatically generated definition]."
<http://purl.obolibrary.org/obo/UBERON_0002346>	"Embryonic ectoderm that gives rise to nervous tissue."
<http://purl.obolibrary.org/obo/CHEBI_79389>	"Any inorganic anion with a valency of one."
<http://purl.obolibrary.org/obo/UBERON_0001948>	"A multi-tissue structure that is part of a spinal cord."
<http://purl.obolibrary.org/obo/UBERON_0004297>	"A blood vessel smooth muscle that is part of a respiratory system [Automatically generated definition]."
<http://purl.obolibrary.org/obo/UBERON_0004370>	"A transparent homogeneous acellular layer, 6 to 9 um thick, lying between the basal lamina of the outer layer of stratified epithelium and the substantia propria of the cornea; it is considered to be a basement membrane."
<http://purl.obolibrary.org/obo/UBERON_0008895>	"Subdivision of endoskeleton derived from pharyngeal arches"
<http://purl.obolibrary.org/obo/UBERON_0005720>	"A venous system that is part of a hindbrain."
<http://purl.obolibrary.org/obo/CHEBI_48218>	"A substance used locally on humans and other animals to destroy harmful microorganisms or to inhibit their activity (cf. disinfectants, which destroy microorganisms found on non-living objects, and antibiotics, which can be transported through the lymphatic system to destroy bacteria within the body)."
<http://purl.obolibrary.org/obo/UBERON_0003526>	"A capillary that is part of a respiratory system [Automatically generated definition]."
<http://purl.obolibrary.org/obo/UBERON_0003601>	"A cartilage that is part of a neck [Automatically generated definition]."
<http://purl.obolibrary.org/obo/UBERON_0007300>	"A blood vessel that is part of a pectoral appendage."
<http://purl.obolibrary.org/obo/UBERON_0007301>	"A blood vessel that is part of a limb/fin."
<http://purl.obolibrary.org/obo/UBERON_0000478>	"A multicellular anatomical structure that is associated with an embryo and derived from the zygote from which it develops, but which does not contribute to the embryo proper or to structures that are part of the same organism after embryogenesis."
<http://purl.obolibrary.org/obo/PATO_0002301>	"A quality that has a value that is decreased compared to normal or average."
<http://purl.obolibrary.org/obo/UBERON_0004291>	"A cone-like structure that is formed when myocardial progenitor cells of the heart field fuse at the midline. The heart rudiment is the first structure of the heart tube."
<http://purl.obolibrary.org/obo/UBERON_0004479>	"Any collection of muscles that is part of a trunk [Automatically generated definition]."
<http://purl.obolibrary.org/obo/UBERON_0003304>	"A blood island that is part of a mesoderm."
<http://purl.obolibrary.org/obo/CHEBI_35441>	"A substance used in the prophylaxis or therapy of infectious diseases."
<http://purl.obolibrary.org/obo/CHEBI_138000>	"An N-alkylpyrrolidine that consists of N-methylpyrrolidine bearing a pyridin-3-yl substituent at position 2."
<http://purl.obolibrary.org/obo/UBERON_0002443>	"A blood vessel that is part of a choroid [Automatically generated definition]."
<http://purl.obolibrary.org/obo/CHEBI_25944>	"Strictly, a substance intended to kill pests. In common usage, any substance used for controlling, preventing, or destroying animal, microbiological or plant pests."
<http://purl.obolibrary.org/obo/CHEBI_33232>	"Intended use of the molecular entity or part thereof by humans."
<http://purl.obolibrary.org/obo/UBERON_0000930>	"Anterior part of the embryonic digestive tract that develops into a mouth. The stomodeum includes as parts an invagination of the ectoderm and the stomodeal cavity."
<http://purl.obolibrary.org/obo/UBERON_0001084>	"A zone of skin that is part of a head [Automatically generated definition]."
<http://purl.obolibrary.org/obo/NBO_0000085>	"\"Emotional behavior related to a state of low mood  and aversion to activity.\" [wikipedia:Depression]"
<http://purl.obolibrary.org/obo/NBO_0000442>	"\"A reflex in which mucus containing foreign particles or irritants is expelled and the nasal cavity is cleanses.\" [wikipedia:Sneeze]"
<http://purl.obolibrary.org/obo/CHEBI_29340>	"A divalent inorganic anion resulting from the removal of two protons from ammonia."
<http://purl.obolibrary.org/obo/UBERON_0005418>	"A limb bud that develops into a hindlimb."
<http://purl.obolibrary.org/obo/UBERON_0000092>	"stage succeeding embryo, including mature structure"
<http://purl.obolibrary.org/obo/UBERON_0001585>	"A vein that carries deoxygenated blood from the upper half of the body into the right atrium of the heart."
<http://purl.obolibrary.org/obo/UBERON_0010883>	"A cartilaginous condensation that has the potential to develop into a forelimb bone."
<http://purl.obolibrary.org/obo/UBERON_0003133>	"An organ involved in reproduction"
<http://purl.obolibrary.org/obo/CHEBI_33598>	"A homocyclic compound in which all of the ring members are carbon atoms."
<http://purl.obolibrary.org/obo/UBERON_0005498>	"Multi-tissue structure that arises from the heart rudiment and will become the heart tube."
<http://purl.obolibrary.org/obo/UBERON_0007280>	"A presumptive structure that has the potential to develop into a endocardium."
<http://purl.obolibrary.org/obo/NBO_0020199>	"Become immobile and reduce other evidence of living state."@en
<http://purl.obolibrary.org/obo/NBO_0000022>	"\"Behavior associated with any process in an organism in which a relatively long-lasting adaptive behavioral change occurs as the result of experience.\" [wikipedia:Learning]"
<http://purl.obolibrary.org/obo/UBERON_0005234>	"An ectoderm that is part of a optic eminence [Automatically generated definition]."
<http://purl.obolibrary.org/obo/CHEBI_47867>	"Anything used in a scientific experiment to indicate the presence of a substance or quality, change in a body, etc."
<http://purl.obolibrary.org/obo/UBERON_0003568>	"A portion of connective tissue that is part of a neck [Automatically generated definition]."
<http://purl.obolibrary.org/obo/UBERON_0014401>	"Any member of the network of tubes that return blood from the renal tissues to the systemic circulation."
<http://purl.obolibrary.org/obo/UBERON_0003517>	"A blood vessel that is part of a kidney [Automatically generated definition]."
<http://purl.obolibrary.org/obo/UBERON_0003920>	"A blood vessel that carries blood from the capillaries toward the heart"
<http://purl.obolibrary.org/obo/UBERON_0035639>	"The parts of the orbital region that are outside of the the eyeball, including the lacrimal apparatus, the extraocular muscles and the eyelids, eyelashes, eyebrows and the conjunctiva"
<http://purl.obolibrary.org/obo/UBERON_0003084>	"Bilateral groups of cells consisting of three rows: one row of endocardial precursors medially and two rows of myocardical precursors laterally. The two populations fuse at the midline to form the heart rudiment or cone."
<http://purl.obolibrary.org/obo/GO_0050802>	"The part of the circadian sleep/wake cycle where the organism is asleep."
<http://purl.obolibrary.org/obo/CHEBI_33672>	"A bicyclic compound in which at least one of the rings contains at least one skeletal heteroatom."
<http://purl.obolibrary.org/obo/CHEBI_33636>	"A molecule that features two fused rings."
<http://purl.obolibrary.org/obo/NBO_0000166>	"\"Endogenously driven roughly 24-hour cycle in biochemical, physiological, or behavioral processes.\" [GOC:bf]"
<http://purl.obolibrary.org/obo/UBERON_0013701>	"A principle subdivision of an organism that includes all structures along the primary axis, typically the anterior-posterior axis, from head to tail, including structures of the body proper where present (for example, ribs), but excluding appendages."
<http://purl.obolibrary.org/obo/UBERON_0003570>	"A portion of connective tissue that is part of a respiratory system [Automatically generated definition]."
<http://purl.obolibrary.org/obo/GO_0032941>	"The controlled release of a substance by a tissue."
<http://purl.obolibrary.org/obo/CHEBI_22695>	"A molecular entity having an available pair of electrons capable of forming a covalent bond with a hydron (Bronsted base) or with the vacant orbital of some other molecular entity (Lewis base)."
<http://purl.obolibrary.org/obo/GO_0003014>	"A organ system process carried out by any of the organs or tissues of the renal system. The renal system maintains fluid balance, and contributes to electrolyte balance, acid/base balance, and disposal of nitrogenous waste products. In humans, the renal system comprises a pair of kidneys, a pair of ureters, urinary bladder, urethra, sphincter muscle and associated blood vessels; in other species, the renal system may comprise related structures (e.g., nephrocytes and malpighian tubules in Drosophila)."
<http://purl.obolibrary.org/obo/UBERON_0005256>	"Mesenchyme that is part of a developing trunk."
<http://purl.obolibrary.org/obo/UBERON_0000468>	"Anatomical structure that is an individual member of a species and consists of more than one cell."
<http://purl.obolibrary.org/obo/UBERON_0002113>	"A paired organ of the urinary tract which has the production of urine as its primary function."
<http://purl.obolibrary.org/obo/NBO_0000071>	"\"Behavior related to the movement facilitated by the generation of hole or tunnel dug into the ground.\" [NBO:GVG]"
<http://purl.obolibrary.org/obo/NBO_0000013>	"Movement from place to place of an organism.\" [GO:0007626]"
<http://purl.obolibrary.org/obo/UBERON_0005730>	"A limb/fin field that has the potential to develop into a pelvic appendage bud mesenchyme."
<http://purl.obolibrary.org/obo/UBERON_0006598>	"Portion of embryonic tissue determined by fate mapping to become a structure."
<http://purl.obolibrary.org/obo/UBERON_0005732>	"A ring of cells capable of forming a limb or paired fin[Gilbert,modified]."
<http://purl.obolibrary.org/obo/UBERON_0010339>	"Mesenchyme that develops_from a head mesenchyme from mesoderm and is part of a 1st arch mandibular mesenchyme."
<http://purl.obolibrary.org/obo/NBO_0000405>	"\"A deep tendon reflex that elicits involuntary contraction of the biceps brachii muscle.\" [NBO:GVG]"
<http://purl.obolibrary.org/obo/NBO_0000404>	"\"A muscle contraction in response to stretching within the muscle.\" [wikipedia:Stretch_reflex]"
<http://purl.obolibrary.org/obo/PATO_0000467>	"A quality inhering in a bearer by virtue of the bearer's existence."
<http://purl.obolibrary.org/obo/PATO_0000462>	"A quality denoting the lack of an entity."
<http://purl.obolibrary.org/obo/NBO_0000089>	"\"A physical aggression behavior involving attack on prey by a predator.\" [NBO:GVG]"
<http://purl.obolibrary.org/obo/NBO_0001952>	"\"Behavior related to the intake of morphine.\" [NBOC:GVG]"
<http://purl.obolibrary.org/obo/PATO_0002198>	"A quality inhering in a bearer by virtue of its constitution."
<http://purl.obolibrary.org/obo/UBERON_0004122>	"Anatomical system that has as its parts the organs concerned with the production and excretion of urine and those concerned with reproduction."
<http://purl.obolibrary.org/obo/UBERON_0000168>	"A section dividing a colon along a proximal-distal axis."
<http://purl.obolibrary.org/obo/UBERON_0004470>	"Any collection of muscles that is part of a pelvic girdle [Automatically generated definition]."
<http://purl.obolibrary.org/obo/UBERON_0004785>	"the mucous membrane lining the respiratory tract"
<http://purl.obolibrary.org/obo/UBERON_0001653>	"The anterior facial vein (facial vein) commences at the side of the root of the nose, and is a direct continuation of the angular vein where it also receives a small nasal branch. It lies behind the facial artery and follows a less tortuous course. It receives blood from the external palatine vein before it either joins the anterior branch of the retromandibular vein to form the common facial vein, or drains directly into the internal jugular vein. [WP,unvetted]."
<http://purl.obolibrary.org/obo/UBERON_0002049>	"An interconnected tubular multi-tissue structure contains fluid that is actively transported around the organism[ZFA]. Examples: vasculature of lung, vasculature of face."
<http://purl.obolibrary.org/obo/UBERON_0003259>	"An endoderm that is part of a midgut [Automatically generated definition]."
<http://purl.obolibrary.org/obo/UBERON_0018112>	"Any portion of smooth muscle tissue that is part of the rectum"
<http://purl.obolibrary.org/obo/UBERON_0016886>	"Any muscle tissue of the distalmost portion of the digestive tract."
<http://purl.obolibrary.org/obo/UBERON_0004220>	"A portion of smooth muscle tissue that is part of a large intestine [Automatically generated definition]."
<http://purl.obolibrary.org/obo/UBERON_0004231>	"A portion of smooth muscle tissue that is part of an anal region [Automatically generated definition]."
<http://purl.obolibrary.org/obo/PATO_0000044>	"A physical quality which inheres in a bearer by virtue of the number of the bearer's repetitive actions in a particular time."
<http://purl.obolibrary.org/obo/NBO_0000037>	"\"A behavior in which an organism produces sounds by a mechanism involving its respiratory system.\" [NBO:GVG]"
<http://purl.obolibrary.org/obo/UBERON_0010046>	"The sum total of mesenchymal tissue in the pharyngeal arch region. Pharyngeal mesenchyme is undifferentiated, loose connective tissue derived mostly from mesoderm, and also contains ectodermally derived neural crest cells."
<http://purl.obolibrary.org/obo/GO_0051931>	"Any process that modulates the frequency, rate or extent of sensory perception, the series of events required for an organism to receive a sensory stimulus, convert it to a molecular signal, and recognize and characterize the signal."
<http://purl.obolibrary.org/obo/GO_0031644>	"Any process that modulates the frequency, rate or extent of a neurophysiological process, an organ system process carried out by any of the organs or tissues of the nervous system."
<http://purl.obolibrary.org/obo/CHEBI_36916>	"A monoatomic or polyatomic species having one or more elementary charges of the proton."
<http://purl.obolibrary.org/obo/UBERON_0002406>	"a double-walled sac containing the heart and the roots of the great vessels."
<http://purl.obolibrary.org/obo/UBERON_0006914>	"An epithelium characterised by its most superficial layer consisting of squamous epithelial cells."
<http://purl.obolibrary.org/obo/UBERON_0011362>	"A blood vasculature that is part of a head."
<http://purl.obolibrary.org/obo/CHEBI_33595>	"Any molecule that consists of a series of atoms joined together to form a ring."
<http://purl.obolibrary.org/obo/UBERON_0003852>	"A neural crest that has_potential_to_developmentally_contribute_to a hindbrain."
<http://purl.obolibrary.org/obo/UBERON_0006347>	"An artery that connects two larger arteries."
<http://purl.obolibrary.org/obo/UBERON_0002417>	"The abdominal segment of the torso."
<http://purl.obolibrary.org/obo/CHEBI_39162>	"A 3-(1-methylpyrrolidin-2-yl)pyridine in which the chiral centre has R-configuration."
<http://purl.obolibrary.org/obo/UBERON_0005173>	"An organ or element that is part of the adbominal segment of the organism. This region can be further subdivided into the abdominal cavity and the pelvic region."
<http://purl.obolibrary.org/obo/CHEBI_64709>	"Any organic molecular entity that is acidic and contains carbon in covalent linkage."
<http://purl.obolibrary.org/obo/CHEBI_39142>	"A molecular entity capable of accepting a hydron from a donor (Bronsted acid)."
<http://purl.obolibrary.org/obo/NBO_0000294>	"\"Behavior stemming from the ability to identify, assess, and control the emotions of oneself, of others, and of groups.\" [wikipedia:Emotional_intelligence]"
<http://purl.obolibrary.org/obo/NBO_0000293>	"\"Behavior related to one or more capacities of the mind.\" [wikipedia:Intelligence]"
<http://purl.obolibrary.org/obo/UBERON_0000179>	"Circulating fluid that is part of the hemolymphoid system. Blood, lymph, interstitial fluid or its analogs."
<http://purl.obolibrary.org/obo/UBERON_0002359>	"Membrane organ which is attached to the pericardial sac proper and the central tendon of diaphragm and is continuous with the pretracheal fascia.[FMA]"
<http://purl.obolibrary.org/obo/UBERON_0006905>	"Mesenchyme that is part of a mandibular prominence."
<http://purl.obolibrary.org/obo/NBO_0000628>	"\"Play behavior that is associated with the pursuit of an individual.\" [NBO:GVG]"
<http://purl.obolibrary.org/obo/NBO_0000049>	"\"Play behavior that is associated with the socialization of an individual into the group.\" [web:http\\://www.bio.davidson.edu/people/vecase/behavior/Spring2009/Sacco/Pages/Play%20Fighting.html]"
<http://purl.obolibrary.org/obo/UBERON_0004465>	"Any collection of muscles that is part of a neck [Automatically generated definition]."
<http://purl.obolibrary.org/obo/CHEBI_27958>	"A tropane alkaloid obtained from leaves of the South American shrub Erythroxylon coca."
<http://purl.obolibrary.org/obo/UBERON_0015716>	"A epithelium that is part of a anal canal."
<http://purl.obolibrary.org/obo/CHEBI_76764>	"Any hydrolase inhibitor that interferes with the action of a hydrolase acting on C-N bonds, other than peptide bonds (EC 3.5.*.*)."
<http://purl.obolibrary.org/obo/UBERON_0005321>	"."
<http://purl.obolibrary.org/obo/UBERON_0004375>	"A bone that is part of an appendage [Automatically generated definition]."
