?cls	?def
<http://purl.obolibrary.org/obo/UBERON_0004139>	"The first recognizable structure derived from the heart field"
<http://purl.obolibrary.org/obo/UBERON_0012314>	"One of five swellings formed during the development of the face"
<http://purl.obolibrary.org/obo/UBERON_0011892>	"Front (ventral) portion of the vascular, pigmentary, or middle coat of the eye, including the ciliary body and the iris."
<http://purl.obolibrary.org/obo/UBERON_0003295>	"Racemose mucous glands beneath the mucous membrane of the pharynx."
<http://purl.obolibrary.org/obo/UBERON_0015418>	"A mesenchyme that is part of a urethra."
<http://purl.obolibrary.org/obo/UBERON_0010321>	"A skeletal element that is part of a orbital region."
<http://purl.obolibrary.org/obo/NBO_0000073>	"The act of repeated grinding, tearing, and or crushing with teeth or jaws [NBO:SMAC]"
<http://purl.obolibrary.org/obo/NBO_0000407>	"\"A reflex that elicits involuntary contraction of the extensor digitorum muscle.\" [NBO:GVG]"
<http://purl.obolibrary.org/obo/NBO_0002362>	"\"Behavior as a result of sensitivity to an anasthetic intake.\" [NBOC:GVG]"
<http://purl.obolibrary.org/obo/UBERON_0005744>	"Anatomical space that is an opening in a bone, usually for passage of blood vessels or nerves."
<http://purl.obolibrary.org/obo/GO_0060073>	"The regulation of body fluids process in which parasympathetic nerves stimulate the bladder wall muscle to contract and expel urine from the body."
<http://purl.obolibrary.org/obo/UBERON_0001731>	"A anatomical space that is enclosed by a pharynx."
<http://purl.obolibrary.org/obo/UBERON_0006677>	"An anatomical boundary that adjacent_to a epithelium."
<http://purl.obolibrary.org/obo/UBERON_0003324>	"Mesenchyme that is part of a developing lower jaw [Automatically generated definition]."
<http://purl.obolibrary.org/obo/UBERON_0003406>	"A cartilage element that is part of a respiratory system [Automatically generated definition]."
<http://purl.obolibrary.org/obo/UBERON_0005688>	"An anatomical cavity that is part of a lens vesicle."
<http://purl.obolibrary.org/obo/NBO_0000296>	"Behavior that facilitates the restoration of normal interactions between parties that recently engaged in a conflict.[NBO:AC]"
<http://purl.obolibrary.org/obo/GO_0051606>	"The series of events in which a stimulus is received by a cell or organism and converted into a molecular signal."
<http://purl.obolibrary.org/obo/UBERON_0015329>	"A basement membrane of epithelium that is part of a respiratory system."
<http://purl.obolibrary.org/obo/UBERON_0005656>	"An epithelium that is part of a lens vesicle."
<http://purl.obolibrary.org/obo/CHEBI_30879>	"A compound in which a hydroxy group, -OH, is attached to a saturated carbon atom."
<http://purl.obolibrary.org/obo/UBERON_0015833>	"A epithelium that is part of a foregut."
<http://purl.obolibrary.org/obo/UBERON_0015152>	"A gland that is typically found in or near the orbital region, in or around either the medial or lateral canthi, and is typically associated with secretions onto the eyeball or associated ducts. Includes the Harderian, nictitans and lacrimal glands."
<http://purl.obolibrary.org/obo/GO_0098801>	"Any process that modulates the frequency, rate or extent of a system process, a multicellular organismal process carried out by the renal system."
<http://purl.obolibrary.org/obo/NBO_0000743>	"\"An aggressive behavior towards other members of the society.\" [NBO:RH]"
<http://purl.obolibrary.org/obo/CHEBI_50996>	"A compound formally derived from ammonia by replacing three hydrogen atoms by organyl groups."
<http://purl.obolibrary.org/obo/CHEBI_38260>	"Any of a class of heterocyclic amines having a saturated five-membered ring."
<http://purl.obolibrary.org/obo/CHEBI_23982>	"Any primary alcohol based on an ethanol skeleton."
<http://purl.obolibrary.org/obo/NBO_0000084>	"\"Behavior related to any biological process in an organism that recurs with a regularity of approximately 24 hours.\" [NBO:GVG]"
<http://purl.obolibrary.org/obo/NBO_0000755>	"\"Observable characteristic of behavior related to the actions or interactions of an organism that are associated with reproduction.\" [NBO:GVG]"
<http://purl.obolibrary.org/obo/UBERON_0000383>	"The subdivision of the musculoskeletal system that consists of all the muscles of the body[VSAO, modified]."
<http://purl.obolibrary.org/obo/UBERON_0012360>	"A bone element that is part of a jaw region."
<http://purl.obolibrary.org/obo/UBERON_0003258>	"An endoderm that is part of a foregut [Automatically generated definition]."
<http://purl.obolibrary.org/obo/UBERON_0005911>	"Epithelium that derives from the endoderm. Examples: urothelium, transitional epithelium of ureter, epithelium of prostatic gland.[FMA]"
<http://purl.obolibrary.org/obo/UBERON_0009141>	"A vein that is part of a craniocervical region."
<http://purl.obolibrary.org/obo/NBO_0000124>	"\"A behavior associated with the tendency of an organism towards being passive and willing to yield to female animals.\" [NBO:GVG]"
<http://purl.obolibrary.org/obo/PATO_0000186>	"An organismal quality inhering in a bearer by virtue of the bearer's behavior aggregate of the responses or reactions or movements in a given situation."
<http://purl.obolibrary.org/obo/NBO_0000384>	"\"Locomotory orientation in response to a temperature gradient.\" [GO:0043052]"
<http://purl.obolibrary.org/obo/NBO_0000718>	"\"A type of seizure induced by the administration of penicillin.\" [NBO:GVG]"
<http://purl.obolibrary.org/obo/UBERON_0000058>	"A tubular structure that transports secreted or excreted substances."
<http://purl.obolibrary.org/obo/NBO_0000620>	"\"An emotional behavior that arises from the perceived resistance to the fulfillment of individual will.\" [wikipedia:Frustration]"
<http://purl.obolibrary.org/obo/UBERON_0004701>	"An endothelium that is part of a venous system [Automatically generated definition]."
<http://purl.obolibrary.org/obo/UBERON_0010359>	"Mesenchyme that develops_from a neural crest and is part of a entire pharyngeal arch associated mesenchyme."
<http://purl.obolibrary.org/obo/GO_0010996>	"Any process that results in a change in state or activity of a cell or an organism (in terms of movement, secretion, enzyme production, gene expression, etc.) as a result of an auditory stimulus."
<http://purl.obolibrary.org/obo/UBERON_0002343>	"Set of all muscles in abdomen."
<http://purl.obolibrary.org/obo/NBO_0002743>	"\"A regulation of drinking behavior process associated with the preference over the type of food that is consumed. \" [NBO:GVG]"
<http://purl.obolibrary.org/obo/UBERON_0004521>	"A vasculature that is part of a muscle organ [Automatically generated definition]."
<http://purl.obolibrary.org/obo/CHEBI_33302>	"A p-block molecular entity containing any pnictogen."
<http://purl.obolibrary.org/obo/GO_0080134>	"Any process that modulates the frequency, rate or extent of a response to stress. Response to stress is a change in state or activity of a cell or an organism (in terms of movement, secretion, enzyme production, gene expression, etc.) as a result of a disturbance in organismal or cellular homeostasis, usually, but not necessarily, exogenous (e.g. temperature, humidity, ionizing radiation)."
<http://purl.obolibrary.org/obo/CHEBI_75787>	"Any metabolite produced during a metabolic reaction in prokaryotes, the taxon that include members of domains such as the bacteria and archaea."
<http://purl.obolibrary.org/obo/NBO_0020266>	"Deposition of spermatophore either on substrate or in body of female."@en
<http://purl.obolibrary.org/obo/UBERON_0004462>	"Any collection of muscles that is part of a body wall [Automatically generated definition]."
<http://purl.obolibrary.org/obo/UBERON_0002213>	"Nonsynovial joint in which the articulating bones or cartilages are connected by cartilage. Examples: Spheno-occipital synchondrosis, first sternocostal joint, pubic symphysis.[FMA]"
<http://purl.obolibrary.org/obo/UBERON_0011695>	"A cardiovascular system that is part of a conceptus."
<http://purl.obolibrary.org/obo/CHEBI_52090>	"An organic anion that is the conjugate base of methanol."
<http://purl.obolibrary.org/obo/CHEBI_64909>	"Any substance that causes disturbance to organisms by chemical reaction or other activity on the molecular scale, when a sufficient quantity is absorbed by the organism."
<http://purl.obolibrary.org/obo/CHEBI_35222>	"A substance that diminishes the rate of a chemical reaction."
<http://purl.obolibrary.org/obo/PATO_0000014>	"A composite chromatic quality composed of hue, saturation and intensity parts."
<http://purl.obolibrary.org/obo/PATO_0002305>	"A quality of an object that has a value that is increased compared to normal or average."
<http://purl.obolibrary.org/obo/NBO_0000212>	"\"Operant conditioning is the use of a behavior's antecedent and/or its consequence to influence the occurrence and form of behavior.\" [wikipedia:Operant_conditioning]"
<http://purl.obolibrary.org/obo/NBO_0000472>	"\"Behavior related to the depletion of the body resources for coping to stress.\" [NBO:GVG]"
<http://purl.obolibrary.org/obo/UBERON_0007391>	"A cartilage tissue that is part of a pelvic appendage."
<http://purl.obolibrary.org/obo/CHEBI_76807>	"An EC 3.5.* (hydrolases acting on non-peptide C-N bonds) inhibitor that interferes with the action of any non-peptide linear amide C-N hydrolase (EC 3.5.1.*)."
<http://purl.obolibrary.org/obo/PATO_0000770>	"A coordination quality of inhering in a bearer by virtue of the bearer's lacking skillful and effective interaction of movement."
<http://purl.obolibrary.org/obo/PATO_0000188>	"A behavioral quality inhering in a bearer by virtue of the bearer's having or lacking skillful and effective interaction of movement."
<http://purl.obolibrary.org/obo/NBO_0000199>	"\"Ability to orient oneself in space, to recognize and follow an itinerary, or to recognize familiar places.\" [NBO:GVG]"
<http://purl.obolibrary.org/obo/UBERON_0012299>	"A mucosa that is part of a urethra."
<http://purl.obolibrary.org/obo/CHEBI_37716>	"Any imide in which the acyl substituents are any two from carboacyl, sulfonyl and phosphoryl"
<http://purl.obolibrary.org/obo/NBO_0000435>	"\"An involuntary muscle contraction that occurs in the middle ear of mammals in response to high-intensity sound stimuli.\" [wikipedia:Acoustic_reflex]"
<http://purl.obolibrary.org/obo/CHEBI_36963>	"An organochalcogen compound containing at least one carbon-oxygen bond."
<http://purl.obolibrary.org/obo/NBO_0000695>	"\"Subtle  status epilepticus consists of electrical seizure activity in the brain that endures when the associated motor responses are fragmentary or even absent.\" [web:http\\://emedicine.medscape.com/article/1164462-overview]"
<http://purl.obolibrary.org/obo/NBO_0000690>	"\"Continuous unremitting seizure lasting longer than 30 minutes or recurrent seizures without regaining consciousness between seizures for greater than 30 minutes.\" [wikipedia:http\\://en.wikipedia.org/wiki/Status_epilepticus]"
<http://purl.obolibrary.org/obo/UBERON_0036217>	"A bodily fluid that is located in the coelom."
<http://purl.obolibrary.org/obo/NBO_0020141>	"Chasing of one animal by another during an agonistic conflict."@en
<http://purl.obolibrary.org/obo/UBERON_0004234>	"A portion of smooth muscle tissue that is part of a iris [Automatically generated definition]."
<http://purl.obolibrary.org/obo/CHEBI_33250>	"A chemical entity constituting the smallest component of an element having the chemical properties of the element."
<http://purl.obolibrary.org/obo/CHEBI_35488>	"A loosely defined group of drugs that tend to reduce the activity of the central nervous system."
<http://purl.obolibrary.org/obo/GO_0050912>	"The series of events involved in the perception of taste in which a gustatory chemical stimulus is received and converted into a molecular signal."
<http://purl.obolibrary.org/obo/NBO_0000658>	"\"Observable characteristic of behavior related to the actions or reactions of an organism in response to a sound.\" [NBO:GVG]"
<http://purl.obolibrary.org/obo/UBERON_0003714>	"Portion of tissue in the nervous system which consists of neurons and glial cells, and may also contain parts of the vasculature."
<http://purl.obolibrary.org/obo/NBO_0000300>	"\"A domineering, assault posture and/or hostile physical action towards animals exhibited by male animals.\" [NBO:GVG]"
<http://purl.obolibrary.org/obo/NBO_0000116>	"\"Gender related exhibition of a domineering, assault posture and/or hostile physical action.\" [NBO:GVG]"
<http://purl.obolibrary.org/obo/GO_0007588>	"The elimination by an organism of the waste products that arise as a result of metabolic activity. These products include water, carbon dioxide (CO2), and nitrogenous compounds."
<http://purl.obolibrary.org/obo/NBO_0000560>	"\"Behavior relating to the plucking of fur/hair or whiskers/vibrissae.\" [NBO:GVG]"
<http://purl.obolibrary.org/obo/NBO_0002794>	"\"A regulation of drinking behavior process associated with the preference over saccharing consumption. \" [NBO:GVG]"
<http://purl.obolibrary.org/obo/NBO_0020048>	"Deposition of eggs either into the medium, or onto a substrate."@en
<http://purl.obolibrary.org/obo/UBERON_0010299>	"Mesenchyme surrounding the developing optic cup which develops into the sclera."
<http://purl.obolibrary.org/obo/NBO_0020142>	"The identification, avoidance, or neutralization of toxic substances in food."@en
<http://purl.obolibrary.org/obo/UBERON_0004906>	"A portion of the gut that is derived from ectoderm."
<http://purl.obolibrary.org/obo/NBO_0000287>	"\"Helping behavior refers to voluntary actions intended to help the others, with reward regarded or disregarded.\" [wikipedia:Helping_behavior]"
<http://purl.obolibrary.org/obo/NBO_0020071>	"Displays or other behaviors performed by pairs in longer term pair bonds to advertise relationship to each other and to other animals nearby."@en
<http://purl.obolibrary.org/obo/UBERON_0002104>	"The sensory system subserving the sense of vision."
<http://purl.obolibrary.org/obo/GO_0051703>	"Any process in which an organism has an effect on an organism of the same species."
<http://purl.obolibrary.org/obo/CHEBI_32988>	"An amide is a derivative of an oxoacid RkE(=O)l(OH)m (l =/= 0) in which an acidic hydroxy group has been replaced by an amino or substituted amino group."
<http://purl.obolibrary.org/obo/UBERON_0007158>	"An anatomical cavity that surrounded_by a anal canal."
<http://purl.obolibrary.org/obo/UBERON_0007010>	"Organism at the cleavage stage."
<http://purl.obolibrary.org/obo/PATO_0000499>	"A duration quality of a process which is relatively low."
<http://purl.obolibrary.org/obo/UBERON_0001827>	"Aqueous substance secreted by the lacrimal gland."
<http://purl.obolibrary.org/obo/UBERON_0012367>	"A muscle layer that is part of an intestine."
<http://purl.obolibrary.org/obo/UBERON_0034995>	"Mesenchyme that is part of a developing jaw [Automatically generated definition]."
<http://purl.obolibrary.org/obo/PATO_0001306>	"A temperature which is relatively low."
<http://purl.obolibrary.org/obo/NBO_0000115>	"\"Exhibiting a domineering, assault posture and/or hostile physical action towards pups.\" [NBO:GVG]"
<http://purl.obolibrary.org/obo/NBO_0000107>	"\"Exhibiting a domineering, assault posture and/or hostile physical action towards mice.\" [NBO:GVG]"
<http://purl.obolibrary.org/obo/CHEBI_49110>	"A drug that acts principally at one or more sites within the peripheral neuroeffector systems, the autonomic system, and motor nerve-skeletal system."
<http://purl.obolibrary.org/obo/NBO_0000709>	"\"A type of seizure induced by the administration of a drug.\" [NBO:GVG]"
<http://purl.obolibrary.org/obo/NBO_0000611>	"\"A form of hallucination that involves perceiving odors without odor stimulus.\" [NBO:GVG]"
<http://purl.obolibrary.org/obo/UBERON_0010252>	"Mesenchyme that develops_from a neural crest and is part of a 1st arch mandibular mesenchyme."
<http://purl.obolibrary.org/obo/UBERON_0010259>	"Mesenchyme that develops_from a neural crest and is part of a 1st arch mesenchyme."
<http://purl.obolibrary.org/obo/CHEBI_36962>	"An organochalcogen compound is a compound containing at least one carbon-chalcogen bond."
<http://purl.obolibrary.org/obo/CHEBI_33304>	"Any p-block molecular entity containing a chalcogen."
<http://purl.obolibrary.org/obo/NBO_0000598>	"\"A locomotory disorder in which sustained muscle contractions cause twisting and repetitive movements or abnormal postures.\" [wikipedia:Dystonia]"
<http://purl.obolibrary.org/obo/NBO_0000009>	"\"Observable characteristic of behavior associated with the specific movement from place to place of an organism.\" [NBO:GVG]"
<http://purl.obolibrary.org/obo/NBO_0000539>	"\"Observable characteristic of feeding behavior that relates to eating.\" [NBO:GVG]"
<http://purl.obolibrary.org/obo/NBO_0015009>	"Consumption behavior that involves inhaling a material (such as finely ground tobacco leaves) through the nose."
<http://purl.obolibrary.org/obo/CHEBI_35554>	"A drug that affects the rate or intensity of cardiac contraction, blood vessel diameter or blood volume."
<http://purl.obolibrary.org/obo/CHEBI_35701>	"A compound formally derived from an oxoacid RkE(=O)l(OH)m (l > 0) and an alcohol, phenol, heteroarenol, or enol by linking with formal loss of water from an acidic hydroxy group of the former and a hydroxy group of the latter."
<http://purl.obolibrary.org/obo/CHEBI_50904>	"A chemical compound, or part thereof, which causes the onset of an allergic reaction by interacting with any of the molecular pathways involved in an allergy."
<http://purl.obolibrary.org/obo/UBERON_0005292>	"Portion of tissue that is contiguous with the embryo and is comprised of portions of tissue or cells that will not contribute to the embryo."
<http://purl.obolibrary.org/obo/NBO_0050002>	"Behavior related to the repeating or looping movement of the whole organism along a circular or round path."
<http://purl.obolibrary.org/obo/CHEBI_23357>	"An organic molecule or ion (usually a metal ion) that is required by an enzyme for its activity. It may be attached either loosely (coenzyme) or tightly (prosthetic group)."
<http://purl.obolibrary.org/obo/NBO_0000203>	"\"A type of priming where the target is a word that has a high probability of appearing with the prime, and is \\\"associated\\\" with it but not necessarily related in semantic features.\" [NBO:GVG]"
<http://purl.obolibrary.org/obo/BFO_0000020>	"A continuant that inheres in or is borne by other entities. Every instance of A requires some specific instance of B which must always be the same."@en
<http://purl.obolibrary.org/obo/BFO_0000017>	"A specifically dependent continuant  that inheres in continuant  entities and are not exhibited in full at every time in which it inheres in an entity or group of entities. The exhibition or actualization of a realizable entity is a particular manifestation, functioning or process that occurs under certain circumstances."@en
<http://purl.obolibrary.org/obo/NBO_0000463>	"\"The perception of familiar objects as approximately the same shape regardless of their distance or angle of view from the observer.\" [NBO:GVG]"
<http://purl.obolibrary.org/obo/NBO_0000465>	"\"Perception related to the identification of objects and their distinction from each other.\" [:http\\://science.jrank.org/pages/5094/Perception.html]"
<http://purl.obolibrary.org/obo/CHEBI_26421>	"Any organonitrogen heterocyclic compound based on a pyridine skeleton and its substituted derivatives."
<http://purl.obolibrary.org/obo/PATO_0000587>	"A size quality which is relatively low."
<http://purl.obolibrary.org/obo/UBERON_0007617>	"An anatomical cavity that surrounded_by a synovial joint."
<http://purl.obolibrary.org/obo/NBO_0000092>	"\"An emotional behavior related to a feeling of uneasiness or nervousness triggered by an identifiable triggering stimulus.\" [NBO:GVG]"
<http://purl.obolibrary.org/obo/NBO_0000426>	"\"Reflexive contraction of the external anal sphincter upon stroking of the skin around the anus.\" [wikipedia:Anal_wink]"
<http://purl.obolibrary.org/obo/CHEBI_35942>	"A substance used for its pharmacological action on any aspect of neurotransmitter systems. Neurotransmitter agents include agonists, antagonists, degradation inhibitors, uptake inhibitors, depleters, precursors, and modulators of receptor function."
<http://purl.obolibrary.org/obo/UBERON_0010161>	"An anatomical cavity that surrounded_by a blood vessel."
<http://purl.obolibrary.org/obo/UBERON_0010328>	"Mesenchyme that is part of a limb bud."
<http://purl.obolibrary.org/obo/CHEBI_36587>	"Organic compounds containing an oxygen atom, =O, doubly bonded to carbon or another element."
<http://purl.obolibrary.org/obo/UBERON_3000981>	"Dermal, epidermal, glandular and pigment structures of the limb integument."
<http://purl.obolibrary.org/obo/NBO_0045005>	"The inhalation and exhalation of marijuana smoke."
<http://purl.obolibrary.org/obo/UBERON_0010303>	"An epithelium that is part of a extraembryonic structure."
<http://purl.obolibrary.org/obo/UBERON_0010362>	"Skeletal subdivision that undergoes indirect development and includes elements that develop as a replacement or substitution of other elements or tissues."
<http://purl.obolibrary.org/obo/NBO_0000055>	"The act of locomoting on limbs with body off the ground such that periodically none of the limbs are touching the ground [NBO:SMAC]"
<http://purl.obolibrary.org/obo/NBO_0020286>	"Removal of food items from location by use of appendage or tool."@en
<http://purl.obolibrary.org/obo/NBO_0000551>	"\"Ability to perceive the physical properties of an object (such as shape, colour and texture) and apply semantic attributes to the object, which includes the understanding of its use, previous experience with the object and how it relates to others.\" [wikipedia:Cognitive_Neuroscience_of_Visual_Object_Recognition]"
<http://purl.obolibrary.org/obo/PATO_0001291>	"A physical quality that inheres in an bearer by virtue of how that bearer interacts with electromagnetic radiation."
<http://purl.obolibrary.org/obo/NBO_0020281>	"General category of behaviors including sampling of medium to detect presence of possible mates, and sampling of encountered individuals to determine mate suitability."@en
<http://purl.obolibrary.org/obo/NBO_0000180>	"\"A type of memory that allows the recall of something from several seconds to as long as a minute.\" [NBO:GVG]"
<http://purl.obolibrary.org/obo/NBO_0000306>	"\"Behavior related with the ability of an organism's ability to store information and experiences.\" [NBO:GVG]"
<http://purl.obolibrary.org/obo/NBO_0000514>	"\"A dyssomnia characterised by fear of sleep.\" [NBO:GVG]"
<http://purl.obolibrary.org/obo/NBO_0000774>	"\"Observable characteristic of behaviour related to the regulated release of the aqueous layer of the tear film from the lacrimal glands.\" [NBO:GVG]"
<http://purl.obolibrary.org/obo/UBERON_0010096>	"A developing anatomical structure that has the potential to develop into a myelencephalon."
<http://purl.obolibrary.org/obo/UBERON_0002241>	"Endoskeletal elements that encase the brain, nose, inner ear[cjm]. that part of the neurocranium formed by endochondral ossification and comprising the bones of the base of the skull[TFD]."
<http://purl.obolibrary.org/obo/NBO_0020034>	"Perform behaviors that may induce one or more other animals to share food with the performer."@en
<http://purl.obolibrary.org/obo/NBO_0020294>	"The act of putting a food resource in a location in which it can be stored or protected until a future time."@en
<http://purl.obolibrary.org/obo/NBO_0020068>	"Caching or hoarding of food for later use and for protection from competitors, or use of specific substrates for cultivation."@en
<http://purl.obolibrary.org/obo/UBERON_0009919>	"The smooth muscle tissue surrounding the epithelium of the ureter"
<http://purl.obolibrary.org/obo/GO_0007606>	"The series of events required for an organism to receive a sensory chemical stimulus, convert it to a molecular signal, and recognize and characterize the signal. This is a neurological process."
<http://purl.obolibrary.org/obo/GO_0007635>	"Behavior that is dependent upon the sensation of chemicals."
<http://purl.obolibrary.org/obo/UBERON_0003351>	"An epithelium that is part of a pharynx [Automatically generated definition]."
<http://purl.obolibrary.org/obo/UBERON_0005081>	"The portion of the ureteric bud that contributes to the morphogenesis of the ureter. The ureter ureteric bud is the initial structure that forms the ureter[GO]."
<http://purl.obolibrary.org/obo/NBO_0000737>	"\"A type of seizure induced by exposure to a light stimulus.\" [NBO:GVG]"
<http://purl.obolibrary.org/obo/UBERON_0003828>	"A bone that is part of an abdominal segment of trunk [Automatically generated definition]."
<http://purl.obolibrary.org/obo/UBERON_0003509>	"A blood vessel that is part of the arterial system. Includes artery, arteriole and aorta."
<http://purl.obolibrary.org/obo/UBERON_0005729>	"A limb/fin field that has the potential to develop into a pectoral appendage bud mesenchyme."
<http://purl.obolibrary.org/obo/CHEBI_50047>	"A compound formally derived from ammonia by replacing one, two or three hydrogen atoms by organyl groups."
<http://purl.obolibrary.org/obo/NBO_0000366>	"\"Behavior related to the movement of an organism from one location to another through the air.\" [NBO:GVG]"
<http://purl.obolibrary.org/obo/NBO_0000602>	"\"Exhibiting indifference, or suppression of emotions such as concern, excitement, motivation and passion.\" [wikipedia:Indifference_(emotion)]"
<http://purl.obolibrary.org/obo/UBERON_0003473>	"An artery that is part of a thoracic cavity[cjm]."
<http://purl.obolibrary.org/obo/NBO_0000329>	"\"Behavior related to the detection of low environmental temperature.\" [NBO:GVG]"
<http://purl.obolibrary.org/obo/UBERON_0004277>	"A muscle that is part of the eye region."
