?cls	?def
<http://purl.obolibrary.org/obo/GO_0007632>	"The behavior of an organism in response to a visual stimulus."
<http://purl.obolibrary.org/obo/CHEBI_60242>	"An atom or small molecule with a positive charge that does not contain carbon in covalent linkage, with a valency of one."
<http://purl.obolibrary.org/obo/UBERON_0005156>	"Any anatomical structure that is part of the reproductive system."
<http://purl.obolibrary.org/obo/UBERON_0010341>	"Mesenchyme that develops_from a head mesenchyme from mesoderm and is part of a 1st arch mesenchyme."
<http://purl.obolibrary.org/obo/NBO_0000132>	"\"A drinking behavior associated with the intake of water.\" [NBO:GVG]"
<http://purl.obolibrary.org/obo/UBERON_0010047>	"Gland of the epithelium lining the oral cavity. The most common are the salivary glands."
<http://purl.obolibrary.org/obo/NBO_0001571>	"\"Behavior as a result of a light stimulus, electromagnetic radiation of wavelengths classified as infrared, visible or ultraviolet light.\" [NBO:GVG]"
<http://purl.obolibrary.org/obo/NBO_0001536>	"\"Behavior as a result of an electromagnetic radiation stimulus.\" [NBO:GVG]"
<http://purl.obolibrary.org/obo/GO_0009416>	"Any process that results in a change in state or activity of a cell or an organism (in terms of movement, secretion, enzyme production, gene expression, etc.) as a result of a light stimulus, electromagnetic radiation of wavelengths classified as infrared, visible or ultraviolet light."
<http://purl.obolibrary.org/obo/UBERON_0002224>	"The part of the coelemic cavity lumen that is enclosed by the walls of the thorax."
<http://purl.obolibrary.org/obo/CHEBI_60643>	"Any substance that inhibits the action of N-methyl-D-aspartate (NMDA) receptors. They tend to induce a state known as dissociative anesthesia, marked by catalepsy, amnesia, and analgesia, while side effects can include hallucinations, nightmares, and confusion. Due to their psychotomimetic effects, many NMDA receptor antagonists are used as recreational drugs."
<http://purl.obolibrary.org/obo/UBERON_0000990>	"Anatomical system that has as its parts the organs concerned with reproduction."
<http://purl.obolibrary.org/obo/UBERON_0003713>	"A vein arising from the splenic trabecular vein in the hilum of the spleen that drains into the portal vein."
<http://purl.obolibrary.org/obo/UBERON_0012476>	"The collection of all skeletal elements in a pelvic complex - i.e. the combination of free limb or fin plus pelvic girdle."
<http://purl.obolibrary.org/obo/UBERON_0000409>	"A gland in which the principal secretory cells are serous secreting cells."
<http://purl.obolibrary.org/obo/UBERON_0000965>	"Transparent part of camera-type eye that helps to refract light to be focused on the retina."
<http://purl.obolibrary.org/obo/UBERON_0005417>	"A limb bud that develops into a forelimb."
<http://purl.obolibrary.org/obo/CHEBI_75767>	"Any eukaryotic metabolite produced during a metabolic reaction in animals that include diverse creatures from sponges, insects to mammals."
<http://purl.obolibrary.org/obo/UBERON_0013241>	"The precursor of the urethra"
<http://purl.obolibrary.org/obo/GO_0065007>	"Any process that modulates a measurable attribute of any biological process, quality or function."
<http://purl.obolibrary.org/obo/UBERON_0003064>	"The intermediate mesoderm is located between the lateral mesoderm and the paraxial mesoderm. It develops into the kidney and gonads."
<http://purl.obolibrary.org/obo/UBERON_0011108>	"A synovial joint that is part of a pectoral girdle region."
<http://purl.obolibrary.org/obo/PATO_0001727>	"A quality inhering in a bearer by virtue of the bearer's prevailing tendency, mood, or inclination."
<http://purl.obolibrary.org/obo/PATO_0001596>	"A depth quality which is relatively high."
<http://purl.obolibrary.org/obo/PATO_0000586>	"A size quality which is relatively high."
<http://purl.obolibrary.org/obo/UBERON_0006003>	"Anatomical structure embedded in or located in the integument that is part of the integumental system. Examples: hair, follicles, skin glands, claws, nails, feathers."
<http://purl.obolibrary.org/obo/UBERON_0003842>	"An anatomical space that surrounded_by a neural tube."
<http://purl.obolibrary.org/obo/CHEBI_50313>	"Mononuclear cations derived by addition of a hydron to a mononuclear parent hydride of the pnictogen, chalcogen and halogen families."
<http://purl.obolibrary.org/obo/UBERON_0003412>	"Mesenchyme that is part of a pelvic appendage bud."
<http://purl.obolibrary.org/obo/NBO_0000339>	"\"The coordination of combinations of body movements created with the kinematic (such as spatial direction) and kinetic (force) parameters that result in intended actions.\" [wikipedia:Motor_coordination]"
<http://purl.obolibrary.org/obo/NBO_0000452>	"\"Behavior related to the state or ability to perceive, to feel, or to be conscious of events, objects or sensory patterns.\" [wikipedia:Awareness]"
<http://purl.obolibrary.org/obo/NBO_0000065>	"\"Behavior related to a variety of aspects of the relationship between the mind and the world with which it interacts.\" [wikipedia:Consciousness]"
<http://purl.obolibrary.org/obo/UBERON_0018257>	"Any portion of submucosa that lines the digestive tract."
<http://purl.obolibrary.org/obo/UBERON_0010364>	"Skeletal subdivision that undergoes direct development and includes elements that either develop in association with the basement membrane of the ectoderm or are homologous with such elements; includes dermatocranium, components of the appendicular skeleton, teeth and tooth-like elements of the oropharynx, and integumentary elements."
<http://purl.obolibrary.org/obo/UBERON_0005617>	"A vein that returns blood from the intestines."
<http://purl.obolibrary.org/obo/UBERON_0000489>	"Compound organ that contains one or more macroscopic anatomical spaces."
<http://purl.obolibrary.org/obo/UBERON_0013700>	"Musculature of the head and neck, spine, and ribs."
<http://purl.obolibrary.org/obo/UBERON_0009973>	"The valve-like structure found at the site of entry of the ureter into the urinary bladder, normally displays an oblique angulation through the detrusor to avoid reflux of urine up the ureters and the kidney"
<http://purl.obolibrary.org/obo/UBERON_0004943>	"The submucous layer of the wall of the urinary bladder."
<http://purl.obolibrary.org/obo/UBERON_0035804>	"The primordial mouth region of the developing head."
<http://purl.obolibrary.org/obo/CHEBI_24852>	"Strictly, a substance intended to kill members of the class Insecta.  In common usage, any substance used for preventing, destroying, repelling or controlling insects."
<http://purl.obolibrary.org/obo/UBERON_0019204>	"Any region of epithelium that is part of a skin region."
<http://purl.obolibrary.org/obo/NBO_0000179>	"\"An increase in behavioral responses following repeated applications of a particular stimulus.\" [wikipedia:Sensitization]"
<http://purl.obolibrary.org/obo/NBO_0002468>	"\"Any process that modulates the frequency, rate or extent of water consumption, the specific actions or reactions of an organism in response to external or internal stimuli.\" [NBOC:GVG]"
<http://purl.obolibrary.org/obo/UBERON_0004473>	"Any collection of muscles that is part of a face."
<http://purl.obolibrary.org/obo/UBERON_0011138>	"Subdivision of the skeletal system which consists of the postcranial axial skeleton plus associated joints."
<http://purl.obolibrary.org/obo/NBO_0000081>	"The act of moving the body core higher, away from the ground [NBO:SMAC]"
<http://purl.obolibrary.org/obo/CHEBI_75771>	"Any mammalian metabolite produced during a metabolic reaction in a mouse (Mus musculus)."
<http://purl.obolibrary.org/obo/NBO_0000415>	"\"An involuntary blinking of the eyelids elicited by stimulation of the cornea.\" [wikipedia:Corneal_reflex]"
<http://purl.obolibrary.org/obo/UBERON_0011143>	"Subdivision of urinary system which consists of the kidney and the ureters."
<http://purl.obolibrary.org/obo/NBO_0000675>	"\"A type of seizure generated by sudden sensor stimulation caused by the environment.\" [NBO:GVG]"
<http://purl.obolibrary.org/obo/UBERON_0004756>	"dermis-derived entity that is made of skeletal tissue."
<http://purl.obolibrary.org/obo/UBERON_0006312>	"Body substance in a liquid or semi-solid state in the eyeball which serves to refract light."
<http://purl.obolibrary.org/obo/UBERON_0006562>	"The pharynx is the part of the digestive system immediately posterior to the mouth[GO]."
<http://purl.obolibrary.org/obo/GO_0050882>	"The movement of an organism or part of an organism using mechanoreceptors, the nervous system, striated muscle and/or the skeletal system that can be controlled at will."
<http://purl.obolibrary.org/obo/UBERON_0034878>	"the area of axial mesoderm that develops into the prechordal plate"
<http://purl.obolibrary.org/obo/NBO_0000011>	"\"A behavior that occurs predominantly or only, in individuals that are part of a group.\" [Wikipedia:Social_behavior]"
<http://purl.obolibrary.org/obo/CHEBI_90852>	"A mixed diacylamine resulting from the formal condensation of the nitrogen of a carboxamide with a sulphonic acid."
<http://purl.obolibrary.org/obo/CHEBI_48219>	"An antimicrobial agent that is applied to non-living objects to destroy harmful microorganisms or to inhibit their activity."
<http://purl.obolibrary.org/obo/NBO_0000638>	"\"The actions or reactions of a female, for the purpose of attracting a sexual partner.\" [GOC:bf]"
<http://purl.obolibrary.org/obo/UBERON_0013411>	"Anatomical cavity that is the lumen of the skull and contains the brain."
<http://purl.obolibrary.org/obo/NBO_0020108>	"Behavior that signifies hostility and predicts an increased probability of attack."@en
<http://purl.obolibrary.org/obo/UBERON_0003457>	"A bone that is part of a head [Automatically generated definition]."
<http://purl.obolibrary.org/obo/NBO_0000540>	"\"Observable characteristic of feeding behavior that relates to drinking.\" [NBO:GVG]"
<http://purl.obolibrary.org/obo/NBO_0000270>	"\"Observable characteristic of behavior associated with the intake of food or liquids.\" [NBO:GVG]"
<http://purl.obolibrary.org/obo/CHEBI_38632>	"Any agent that affects the transport of molecular entities across a biological membrane."
<http://purl.obolibrary.org/obo/UBERON_0011857>	"An acinus that is part of a lacrimal gland."
<http://purl.obolibrary.org/obo/UBERON_0011858>	"An acinus that is part of a exocrine gland."
<http://purl.obolibrary.org/obo/PATO_0001562>	"A mass which is lower than normal or average."
<http://purl.obolibrary.org/obo/UBERON_0001441>	"Subdivision of skeleton consisting of all skeletal elements in an hindlimb region."
<http://purl.obolibrary.org/obo/NBO_0000548>	"\"Behaviour related to the male activity which primary purpose is the sexual reproduction.\" [NBO:GVG]"
<http://purl.obolibrary.org/obo/UBERON_0008229>	"Musculature system of the pharyngeal and head regions."
<http://purl.obolibrary.org/obo/UBERON_0014903>	"A portion of tissue that will develop into vasculature."
<http://purl.obolibrary.org/obo/UBERON_0003610>	"The type of heart connective tissue found in the endocardial layer that consists mainly of elastic fibers."
<http://purl.obolibrary.org/obo/UBERON_0005496>	"Portion of tissue on the side of the lumen of the neural tube."
<http://purl.obolibrary.org/obo/UBERON_0004148>	"Vein of heart that drains the myocardium"
<http://purl.obolibrary.org/obo/NBO_0001845>	"\"Behavior related to the intake of substances.\" [NBOC:GVG]"
<http://purl.obolibrary.org/obo/NBO_0000313>	"\"The action, reaction, or performance of an organism in response to external or internal stimuli.\" [GO:GO\\:0007610]"
<http://purl.obolibrary.org/obo/CHEBI_33253>	"Heavy nuclear particle: proton or neutron."
<http://purl.obolibrary.org/obo/NBO_0000007>	"The act of moving any of the tissues and hard structures surrounding the mouth other than teeth, jaws or filter structures [NBO:AC]"
<http://purl.obolibrary.org/obo/NBO_0000001>	"A change of place or position of part of an organism that does not involve the entire organism [NBO:SMAC]"
<http://purl.obolibrary.org/obo/PATO_0002000>	"A quality of physical entities inhering in a bearer by virtue of the bearer's lacking a physical part as specified by the additional entity."
<http://purl.obolibrary.org/obo/PATO_0001999>	"The bearer of this quality has_part < n of the indicated entity type, where n is the normal amount for a comparable organism. Note that the bearer of the quality is the whole, not the part. Formally: If a bearer entity e has fewer parts of type X at time t, then the number of instances x of X at t such that x part_of e is < n, where n is either the normal number for comparable entities, or n is stated explicitly. This case includes the limit case, where the bearer lacks all parts of the specified type."
<http://purl.obolibrary.org/obo/UBERON_0003329>	"A submucosa that is part of an anal canal [Automatically generated definition]."
<http://purl.obolibrary.org/obo/NBO_0000503>	"\"A REM parasomnia characterised by the lack of muscle atonia during sleep.\" [wikipedia:REM_Sleep_Behavior_Disorder]"
<http://purl.obolibrary.org/obo/NBO_0000504>	"\"A type of parasomnia that occurs during REM sleep.\" [NBO:GVG]"
<http://purl.obolibrary.org/obo/GO_0006950>	"Any process that results in a change in state or activity of a cell or an organism (in terms of movement, secretion, enzyme production, gene expression, etc.) as a result of a disturbance in organismal or cellular homeostasis, usually, but not necessarily, exogenous (e.g. temperature, humidity, ionizing radiation)."
<http://purl.obolibrary.org/obo/NBO_0000763>	"\"Observable characteristic of behavior related to the female activity which primary purpose is the sexual reproduction.\" [NBO:GVG]"
<http://purl.obolibrary.org/obo/UBERON_0008907>	"Skeletal element that forms superficially in the organism, usually in association with the ectoderm[VSAO]."
<http://purl.obolibrary.org/obo/CHEBI_33257>	"A derivative of two oxoacids RkE(=O)l(OH)m (l =/= 0) in which two acyl groups are attached to the amino or substituted amino group."
<http://purl.obolibrary.org/obo/UBERON_0006965>	"The vascular cord is the primordial vasculature that will develop into blood vessels by the process of tubulogenesis[GO]. The vascular cord is composed of angioblast or vascular endothelial cells in a solid linear mass called a cord. The cord then undergoes tubulogenesis to form the lumen of the vessels[ZFA]."
<http://purl.obolibrary.org/obo/UBERON_0004808>	"An epithelium that is part of a digestive system [Automatically generated definition]."
<http://purl.obolibrary.org/obo/CHEBI_33285>	"A heteroorganic entity is an organic molecular entity in which carbon atoms or organic groups are bonded directly to one or more heteroatoms."
<http://purl.obolibrary.org/obo/NBO_0000127>	"Behavior by which an animal removes itself spatially from an agonistic encounter in which it is not the winner [NBO:AC]"
<http://purl.obolibrary.org/obo/NBO_0020023>	"Signal or behavior that reveals presence of the signaller directed to multiple receivers and not limited to particular receivers."@en
<http://purl.obolibrary.org/obo/NBO_0020242>	"Creation of or modification of a structure or area that is used in attraction of mates."@en
<http://purl.obolibrary.org/obo/UBERON_0000094>	"Nonparenchymatous organ that primarily consists of dense connective tissue organized into a sheet which interconnects two or more organs, separates two or more body spaces from one another, or surrounds an organ or body part. Examples: interosseous membrane of forearm, obturator membrane, tympanic membrane, fibrous pericardium, fascia lata, dura mater. [FMA]"
<http://purl.obolibrary.org/obo/UBERON_0022350>	"Serous membrane layer that is adjacent to and lines an organ."
<http://purl.obolibrary.org/obo/NBO_0002519>	"\"A pathological drinking behavior characterised by a lack of desire to drink.\" [NBO:GVG]"
<http://purl.obolibrary.org/obo/UBERON_0003502>	"A blood vessel that is part of a neck [Automatically generated definition]."
<http://purl.obolibrary.org/obo/UBERON_0001416>	"A zone of skin that is part of an abdomen [Automatically generated definition]."
<http://purl.obolibrary.org/obo/UBERON_0015420>	"A valve that is part of a ureter."
<http://purl.obolibrary.org/obo/NBO_0000392>	"\"A reflex that arises when tilting the head back while lying on the back causes the back to stiffen and even arch backwards, the legs to straighten, stiffen, and push together, the toes to point, the arms to bend at the elbows and wrists, and the hands to become fisted or the fingers to curl.\" [wikipedia:Tonic_labyrinthine_reflex]"
<http://purl.obolibrary.org/obo/NBO_0000390>	"\"Reflex actions originating in the central nervous system that are exhibited by normal infants in response to particular stimuli.\" [wikipedia:Primitive_reflexes]"
<http://purl.obolibrary.org/obo/NBO_0000726>	"\"A type of seizure induced by the administration of a brain trauma.\" [NBO:GVG]"
<http://purl.obolibrary.org/obo/UBERON_0002075>	"An organ that is located within the body cavity (or in its extension, in the scrotum); it consists of organ parts that are embryologically derived from endoderm, splanchnic mesoderm or intermediate mesoderm; together with other organs, the viscus constitutes the respiratory, gastrointestinal, urinary, reproductive and immune systems, or is the central organ of the cardiovascular system. Examples: heart, lung, esophagus, kidney, ovary, spleen."
<http://purl.obolibrary.org/obo/UBERON_0014387>	"Mesenchyme that develops_from the neural crest[Automatically generated definition]."
<http://purl.obolibrary.org/obo/NBO_0003161>	"Behavior response to an addictive substance resulting from dependence of that addictive substance as well as unctronllable cravings of that substance. [NBOC:GVG]"
<http://purl.obolibrary.org/obo/UBERON_0007779>	"Any bodily fluid that has passed through a membrane such as the capillary wall, as a result of unbalanced hydrostatic and osmotic forces"
<http://purl.obolibrary.org/obo/UBERON_0000415>	"An anatomical wall that is part of an artery [Automatically generated definition]."
<http://purl.obolibrary.org/obo/UBERON_0004702>	"A blood vessel endothelium that is part of a respiratory system [Automatically generated definition]."
<http://purl.obolibrary.org/obo/UBERON_0001915>	"An endothelium that is part of a capillary [Automatically generated definition]."
<http://purl.obolibrary.org/obo/UBERON_0006675>	"A valve that is part of a vein."
<http://purl.obolibrary.org/obo/PATO_0001995>	"A quality that inheres in an entire organism or part of an organism."
<http://purl.obolibrary.org/obo/PATO_0001241>	"A quality which inheres in a continuant."
<http://purl.obolibrary.org/obo/GO_0060259>	"Any process that modulates the rate, frequency or extent of the behavior associated with the intake of food."
<http://purl.obolibrary.org/obo/UBERON_0001140>	"Either of the pair of major vessels which arise from the renal hilus and return blood from the kidneys, suprarenal gland and the ureter to the inferior vena cava."
<http://purl.obolibrary.org/obo/NBO_0000355>	"\"Intentionally or habitually assumed arrangement of the body and its limbs.\" [NBO:GVG]"
<http://purl.obolibrary.org/obo/PATO_0002360>	"A disposition that can be compared on a linear scale - that is that it can be increased or decreased."
<http://purl.obolibrary.org/obo/CHEBI_55505>	"A benzothiazole consisting of a benzene ring fused to an isothiazole."
<http://purl.obolibrary.org/obo/UBERON_0000161>	"Anatomical conduit that connects two adjacent body spaces (or a body space with the space surrounding the organism)[FMA,modified]."
<http://purl.obolibrary.org/obo/GO_0050910>	"The series of events involved in the perception of sound vibration in which the vibration is received and converted into a molecular signal."
<http://purl.obolibrary.org/obo/UBERON_0004770>	"Anatomical system that consists of all the joints of the body."
<http://purl.obolibrary.org/obo/UBERON_0011574>	"A tube lumen that is part of a mesonephric duct."
<http://purl.obolibrary.org/obo/UBERON_0005082>	"A hole in a tube[GO]."
<http://purl.obolibrary.org/obo/UBERON_0009846>	"An epithelium that is part of a embryonic cloaca."
<http://purl.obolibrary.org/obo/UBERON_0009521>	"An endoderm that is part of a anal region."
<http://purl.obolibrary.org/obo/UBERON_0012481>	"An epithelium that is part of a cloaca."
<http://purl.obolibrary.org/obo/UBERON_0004696>	"A portion of smooth muscle tissue that is part of a venous system [Automatically generated definition]."
<http://purl.obolibrary.org/obo/UBERON_0005427>	"Portion of tissue that is part of the eye and gives rise to the mature, fully layered cornea."
<http://purl.obolibrary.org/obo/UBERON_0004236>	"A portion of smooth muscle tissue that is part of an arteriole [Automatically generated definition]."
<http://purl.obolibrary.org/obo/UBERON_0004932>	"A submucosa that is part of a sigmoid colon [Automatically generated definition]."
<http://purl.obolibrary.org/obo/UBERON_0007100>	"A hollow, muscular organ, which, by contracting rhythmically, keeps up the circulation of the blood or analogs[GO,modified]."
<http://purl.obolibrary.org/obo/UBERON_0005181>	"An organ that part of the thoracic segment region. This region can be further subdividied chest and thoracic cavity regions."
<http://purl.obolibrary.org/obo/NBO_0020111>	"Behavior in which one animal causes bodily damage to another."@en
<http://purl.obolibrary.org/obo/GO_1905787>	"Any process that modulates the frequency, rate or extent of detection of mechanical stimulus involved in sensory perception of touch."
<http://purl.obolibrary.org/obo/UBERON_0005062>	"One of the two elevated edges of the neural groove[GO,MP]."
<http://purl.obolibrary.org/obo/UBERON_0003354>	"An epithelium that is part of a rectum [Automatically generated definition]."
<http://purl.obolibrary.org/obo/UBERON_0016885>	"Epithelium lining the distalmost portion of the digestive tract."
<http://purl.obolibrary.org/obo/NBO_0002273>	"\"Any process that modulates the frequency, rate or extent of nicotine consumption, the specific actions or reactions of an organism in response to external or internal stimuli.\" [NBOC:GVG]"
<http://purl.obolibrary.org/obo/NBO_0002234>	"\"Any process that modulates the frequency, rate or extent of consumption of an addictive substance, the specific actions or reactions of an organism in response to external or internal stimuli.\" [NBOC:GVG]"
<http://purl.obolibrary.org/obo/UBERON_0001068>	"A zone of skin that is part of a back [Automatically generated definition]."
<http://purl.obolibrary.org/obo/NBO_0000578>	"\"A reflex process in which an animal immediately tries to turn over after being placed in a supine position.\" [NBO:GVG]"
<http://purl.obolibrary.org/obo/UBERON_0007832>	"Skeletal subdivision consisting of a set of bones linking the axial series to the hindlimb zeugopodium and offering anchoring areas for hindlimb and caudal musculature."
<http://purl.obolibrary.org/obo/UBERON_0013232>	"The secretory unit of a serous gland. The acinar portion is composed of serous secreting cells."
<http://purl.obolibrary.org/obo/NBO_0000220>	"\"The sociological process of training individuals in a society to act or respond in a manner generally approved by the society in general and peer groups within society.\" [wikipedia:Social_conditioning]"
<http://purl.obolibrary.org/obo/UBERON_0001917>	"An endothelium that is part of an artery [Automatically generated definition]."
<http://purl.obolibrary.org/obo/UBERON_0035551>	"The part of the circulatory system that lies deep beneath the subcutaneous tissue layers away from the surface of the skin."
<http://purl.obolibrary.org/obo/UBERON_0003932>	"A cartilage element of chondrocranium. Example: neurocranial trabecula."
<http://purl.obolibrary.org/obo/NBO_0000480>	"\"A sleep breathing disorder characterized by abnormal pauses in breathing or instances of abnormally low breathing, during sleep.\" [wikipedia:Sleep_apnea]"
<http://purl.obolibrary.org/obo/NBO_0000494>	"\"An intrinsic sleep disorder characterised by breathing abnormalities.\" [NBO:GVG]"
<http://purl.obolibrary.org/obo/UBERON_0000317>	"Mucosa that is part of a colon. The mucosa of the colon is lined by a simple columnar epithelium with a thin brush border and numerous goblet cells."
<http://purl.obolibrary.org/obo/NBO_0020098>	"Behavior by one animals soliciting food provision by a potential mate."@en
<http://purl.obolibrary.org/obo/UBERON_0015783>	"A smooth muscle tissue that is part of a hypodermis."
<http://purl.obolibrary.org/obo/UBERON_0000111>	"A stage at which the ectoderm, endoderm, and mesoderm develop into the internal organs of the organism."
<http://purl.obolibrary.org/obo/UBERON_0003475>	"A vein that is part of a ureter [Automatically generated definition]."
<http://purl.obolibrary.org/obo/UBERON_0034925>	"A collection of anatomical structures that are alike in terms of their morphology or developmental origin."
<http://purl.obolibrary.org/obo/NBO_0000443>	"\"A contraction of muscles in the gastrointestinal tract in response to distension of the tract following consumption of food and drink.\" [wikipedia:Vagus_reflex]"
<http://purl.obolibrary.org/obo/UBERON_0007098>	"Cranial neural crest that migrates into the mandibular arch."
<http://purl.obolibrary.org/obo/GO_0007589>	"The controlled release of a fluid by a cell or tissue in an animal."
<http://purl.obolibrary.org/obo/UBERON_0036225>	"Any gland that is part os the respiratory system."
<http://purl.obolibrary.org/obo/UBERON_0003463>	"A bone that is part of a trunk [Automatically generated definition]."
<http://purl.obolibrary.org/obo/UBERON_0018150>	"A zone of skin that is part of a lower lip."
<http://purl.obolibrary.org/obo/CHEBI_38867>	"Substance which produces loss of feeling or sensation."
<http://purl.obolibrary.org/obo/CHEBI_35617>	"A food additive that is used to added improve the taste or odour of a food."
